{
  "$schema": "http://json-schema.org/draft-07/schema#",
  "additionalProperties": false,
  "$id": "walk-paths",
  "title": "walk-paths fixture",
  "type": "object",
  "required": ["name", "description", "generator", "version", "seed", "cases"],
  "properties": {
    "name": {
      "description": "equals the file name without .json",
      "const": "walk-paths",
      "type": "string"
    },
    "description": {
      "minLength": 1,
      "type": "string"
    },
    "generator": {
      "pattern": "^scripts/generate\\.ts#[A-Za-z]+$",
      "type": "string"
    },
    "version": {
      "minimum": 1,
      "description": "bump when the shape (not the values) changes",
      "type": "integer"
    },
    "seed": {
      "description": "PRNG seed used by the generator",
      "type": "integer"
    },
    "cases": {
      "minItems": 1,
      "type": "array",
      "items": {
        "additionalProperties": false,
        "type": "object",
        "required": ["id", "description", "input", "expected"],
        "properties": {
          "id": {
            "minLength": 1,
            "description": "unique within the file; used in test names",
            "type": "string"
          },
          "description": {
            "minLength": 1,
            "type": "string"
          },
          "input": {
            "additionalProperties": false,
            "type": "object",
            "required": ["resolution", "simplifyToleranceM", "samples"],
            "properties": {
              "resolution": {
                "minimum": 0,
                "maximum": 15,
                "type": "integer"
              },
              "simplifyToleranceM": {
                "minimum": 0,
                "type": "number"
              },
              "pedometerSteps": {
                "minimum": 0,
                "type": "integer"
              },
              "samples": {
                "type": "array",
                "items": {
                  "additionalProperties": false,
                  "type": "object",
                  "required": ["seq", "ts", "lat", "lon", "hAcc"],
                  "properties": {
                    "seq": {
                      "minimum": 0,
                      "type": "integer"
                    },
                    "ts": {
                      "pattern": "^\\d{4}-\\d{2}-\\d{2}T\\d{2}:\\d{2}:\\d{2}(\\.\\d+)?Z$",
                      "description": "ISO 8601 UTC timestamp (Z suffix)",
                      "type": "string"
                    },
                    "lat": {
                      "minimum": -90,
                      "maximum": 90,
                      "type": "number"
                    },
                    "lon": {
                      "minimum": -180,
                      "maximum": 180,
                      "type": "number"
                    },
                    "hAcc": {
                      "minimum": 0,
                      "description": "horizontal accuracy in metres",
                      "type": "number"
                    },
                    "speed": {
                      "anyOf": [
                        {
                          "description": "finite number",
                          "type": "number"
                        },
                        {
                          "type": "null"
                        }
                      ]
                    },
                    "course": {
                      "anyOf": [
                        {
                          "description": "finite number",
                          "type": "number"
                        },
                        {
                          "type": "null"
                        }
                      ]
                    },
                    "alt": {
                      "anyOf": [
                        {
                          "description": "finite number",
                          "type": "number"
                        },
                        {
                          "type": "null"
                        }
                      ]
                    }
                  }
                }
              }
            }
          },
          "expected": {
            "additionalProperties": false,
            "type": "object",
            "required": [
              "acceptedSeqs",
              "rejected",
              "flags",
              "distanceM",
              "simplifiedPointCount",
              "hexMeters"
            ],
            "properties": {
              "acceptedSeqs": {
                "type": "array",
                "items": {
                  "minimum": 0,
                  "type": "integer"
                }
              },
              "rejected": {
                "type": "array",
                "items": {
                  "additionalProperties": false,
                  "type": "object",
                  "required": ["seq", "reason"],
                  "properties": {
                    "seq": {
                      "minimum": 0,
                      "type": "integer"
                    },
                    "reason": {
                      "anyOf": [
                        {
                          "const": "accuracy",
                          "type": "string"
                        },
                        {
                          "const": "speed",
                          "type": "string"
                        },
                        {
                          "const": "non_monotonic",
                          "type": "string"
                        }
                      ]
                    }
                  }
                }
              },
              "flags": {
                "type": "array",
                "items": {
                  "anyOf": [
                    {
                      "const": "teleport",
                      "type": "string"
                    },
                    {
                      "const": "speed",
                      "type": "string"
                    },
                    {
                      "const": "distance",
                      "type": "string"
                    },
                    {
                      "const": "no_steps",
                      "type": "string"
                    }
                  ]
                }
              },
              "distanceM": {
                "minimum": 0,
                "description": "haversine length of the simplified accepted path",
                "type": "number"
              },
              "simplifiedPointCount": {
                "minimum": 0,
                "type": "integer"
              },
              "hexMeters": {
                "description": "sorted by cell ascending; tolerance ±0.5 m",
                "type": "array",
                "items": {
                  "additionalProperties": false,
                  "type": "object",
                  "required": ["cell", "meters"],
                  "properties": {
                    "cell": {
                      "pattern": "^[0-9a-f]{15}$",
                      "description": "H3 index string",
                      "type": "string"
                    },
                    "meters": {
                      "minimum": 0,
                      "type": "number"
                    }
                  }
                }
              }
            }
          }
        }
      }
    }
  }
}
