{
  "name": "walk-paths",
  "description": "Six synthetic walks (straight-line, edge-hugging, loop-inside-one-cell, noisy-zigzag, teleport, car-speed) exercising acceptSamples, walkFlags, simplifyPath (Douglas–Peucker 5 m) and pathToHexMeters at res 9. Expected values come from the reference implementation in scripts/generate.ts (0.05 m stepping + bisection to 0.1 mm); tolerance ±0.5 m per cell. The sparse straight-line segment seq 50→51 crosses two cell boundaries.",
  "generator": "scripts/generate.ts#walkPaths",
  "version": 1,
  "seed": 20260907,
  "cases": [
    {
      "id": "straight-line",
      "description": "1.2 km NE (bearing 45°) from 54.89,23.90 across ≥ 4 res-9 cells, 1 sample per 5 s at 1.4 m/s with ±1.5 m lateral jitter that DP removes; one accuracy reject (hAcc 80 at 140 m); a 399 m GPS dropout (285 s) makes one sparse segment that crosses two cell boundaries; pedometer 1500 steps (plausible).",
      "input": {
        "resolution": 9,
        "simplifyToleranceM": 5,
        "pedometerSteps": 1500,
        "samples": [
          {
            "seq": 0,
            "ts": "2026-09-07T08:00:00Z",
            "lat": 54.8900021,
            "lon": 23.8999964,
            "hAcc": 8,
            "speed": 1.4,
            "course": 45,
            "alt": 60
          },
          {
            "seq": 1,
            "ts": "2026-09-07T08:00:05Z",
            "lat": 54.8900394,
            "lon": 23.9000863,
            "hAcc": 8,
            "speed": 1.4,
            "course": 45,
            "alt": 60
          },
          {
            "seq": 2,
            "ts": "2026-09-07T08:00:10Z",
            "lat": 54.8900866,
            "lon": 23.9001591,
            "hAcc": 8,
            "speed": 1.4,
            "course": 45,
            "alt": 60
          },
          {
            "seq": 3,
            "ts": "2026-09-07T08:00:15Z",
            "lat": 54.890141,
            "lon": 23.9002193,
            "hAcc": 8,
            "speed": 1.4,
            "course": 45,
            "alt": 60
          },
          {
            "seq": 4,
            "ts": "2026-09-07T08:00:20Z",
            "lat": 54.890184,
            "lon": 23.9002992,
            "hAcc": 8,
            "speed": 1.4,
            "course": 45,
            "alt": 60
          },
          {
            "seq": 5,
            "ts": "2026-09-07T08:00:25Z",
            "lat": 54.8902224,
            "lon": 23.9003873,
            "hAcc": 8,
            "speed": 1.4,
            "course": 45,
            "alt": 60
          },
          {
            "seq": 6,
            "ts": "2026-09-07T08:00:30Z",
            "lat": 54.8902685,
            "lon": 23.9004619,
            "hAcc": 8,
            "speed": 1.4,
            "course": 45,
            "alt": 60
          },
          {
            "seq": 7,
            "ts": "2026-09-07T08:00:35Z",
            "lat": 54.8903076,
            "lon": 23.9005486,
            "hAcc": 8,
            "speed": 1.4,
            "course": 45,
            "alt": 60
          },
          {
            "seq": 8,
            "ts": "2026-09-07T08:00:40Z",
            "lat": 54.8903538,
            "lon": 23.9006233,
            "hAcc": 8,
            "speed": 1.4,
            "course": 45,
            "alt": 60
          },
          {
            "seq": 9,
            "ts": "2026-09-07T08:00:45Z",
            "lat": 54.8904005,
            "lon": 23.9006968,
            "hAcc": 8,
            "speed": 1.4,
            "course": 45,
            "alt": 60
          },
          {
            "seq": 10,
            "ts": "2026-09-07T08:00:50Z",
            "lat": 54.8904472,
            "lon": 23.9007705,
            "hAcc": 8,
            "speed": 1.4,
            "course": 45,
            "alt": 60
          },
          {
            "seq": 11,
            "ts": "2026-09-07T08:00:55Z",
            "lat": 54.8904979,
            "lon": 23.900837,
            "hAcc": 8,
            "speed": 1.4,
            "course": 45,
            "alt": 60
          },
          {
            "seq": 12,
            "ts": "2026-09-07T08:01:00Z",
            "lat": 54.8905423,
            "lon": 23.9009147,
            "hAcc": 8,
            "speed": 1.4,
            "course": 45,
            "alt": 60
          },
          {
            "seq": 13,
            "ts": "2026-09-07T08:01:05Z",
            "lat": 54.8905763,
            "lon": 23.9010103,
            "hAcc": 8,
            "speed": 1.4,
            "course": 45,
            "alt": 60
          },
          {
            "seq": 14,
            "ts": "2026-09-07T08:01:10Z",
            "lat": 54.8906214,
            "lon": 23.9010866,
            "hAcc": 8,
            "speed": 1.4,
            "course": 45,
            "alt": 60
          },
          {
            "seq": 15,
            "ts": "2026-09-07T08:01:15Z",
            "lat": 54.8906676,
            "lon": 23.9011612,
            "hAcc": 8,
            "speed": 1.4,
            "course": 45,
            "alt": 60
          },
          {
            "seq": 16,
            "ts": "2026-09-07T08:01:20Z",
            "lat": 54.8907053,
            "lon": 23.9012505,
            "hAcc": 8,
            "speed": 1.4,
            "course": 45,
            "alt": 60
          },
          {
            "seq": 17,
            "ts": "2026-09-07T08:01:25Z",
            "lat": 54.8907542,
            "lon": 23.9013202,
            "hAcc": 8,
            "speed": 1.4,
            "course": 45,
            "alt": 60
          },
          {
            "seq": 18,
            "ts": "2026-09-07T08:01:30Z",
            "lat": 54.890797,
            "lon": 23.9014005,
            "hAcc": 8,
            "speed": 1.4,
            "course": 45,
            "alt": 60
          },
          {
            "seq": 19,
            "ts": "2026-09-07T08:01:35Z",
            "lat": 54.8908526,
            "lon": 23.9014587,
            "hAcc": 8,
            "speed": 1.4,
            "course": 45,
            "alt": 60
          },
          {
            "seq": 20,
            "ts": "2026-09-07T08:01:40Z",
            "lat": 54.8908939,
            "lon": 23.9015417,
            "hAcc": 80,
            "speed": 1.4,
            "course": 45,
            "alt": 60
          },
          {
            "seq": 21,
            "ts": "2026-09-07T08:01:45Z",
            "lat": 54.8909318,
            "lon": 23.9016306,
            "hAcc": 8,
            "speed": 1.4,
            "course": 45,
            "alt": 60
          },
          {
            "seq": 22,
            "ts": "2026-09-07T08:01:50Z",
            "lat": 54.8909742,
            "lon": 23.9017116,
            "hAcc": 8,
            "speed": 1.4,
            "course": 45,
            "alt": 60
          },
          {
            "seq": 23,
            "ts": "2026-09-07T08:01:55Z",
            "lat": 54.8910243,
            "lon": 23.9017794,
            "hAcc": 8,
            "speed": 1.4,
            "course": 45,
            "alt": 60
          },
          {
            "seq": 24,
            "ts": "2026-09-07T08:02:00Z",
            "lat": 54.8910753,
            "lon": 23.9018454,
            "hAcc": 8,
            "speed": 1.4,
            "course": 45,
            "alt": 60
          },
          {
            "seq": 25,
            "ts": "2026-09-07T08:02:05Z",
            "lat": 54.8911214,
            "lon": 23.9019201,
            "hAcc": 8,
            "speed": 1.4,
            "course": 45,
            "alt": 60
          },
          {
            "seq": 26,
            "ts": "2026-09-07T08:02:10Z",
            "lat": 54.8911584,
            "lon": 23.9020105,
            "hAcc": 8,
            "speed": 1.4,
            "course": 45,
            "alt": 60
          },
          {
            "seq": 27,
            "ts": "2026-09-07T08:02:15Z",
            "lat": 54.8911937,
            "lon": 23.902104,
            "hAcc": 8,
            "speed": 1.4,
            "course": 45,
            "alt": 60
          },
          {
            "seq": 28,
            "ts": "2026-09-07T08:02:20Z",
            "lat": 54.8912555,
            "lon": 23.9021513,
            "hAcc": 8,
            "speed": 1.4,
            "course": 45,
            "alt": 60
          },
          {
            "seq": 29,
            "ts": "2026-09-07T08:02:25Z",
            "lat": 54.8912836,
            "lon": 23.9022573,
            "hAcc": 8,
            "speed": 1.4,
            "course": 45,
            "alt": 60
          },
          {
            "seq": 30,
            "ts": "2026-09-07T08:02:30Z",
            "lat": 54.8913449,
            "lon": 23.9023054,
            "hAcc": 8,
            "speed": 1.4,
            "course": 45,
            "alt": 60
          },
          {
            "seq": 31,
            "ts": "2026-09-07T08:02:35Z",
            "lat": 54.8913837,
            "lon": 23.9023928,
            "hAcc": 8,
            "speed": 1.4,
            "course": 45,
            "alt": 60
          },
          {
            "seq": 32,
            "ts": "2026-09-07T08:02:40Z",
            "lat": 54.8914334,
            "lon": 23.9024611,
            "hAcc": 8,
            "speed": 1.4,
            "course": 45,
            "alt": 60
          },
          {
            "seq": 33,
            "ts": "2026-09-07T08:02:45Z",
            "lat": 54.8914626,
            "lon": 23.9025653,
            "hAcc": 8,
            "speed": 1.4,
            "course": 45,
            "alt": 60
          },
          {
            "seq": 34,
            "ts": "2026-09-07T08:02:50Z",
            "lat": 54.8915138,
            "lon": 23.9026309,
            "hAcc": 8,
            "speed": 1.4,
            "course": 45,
            "alt": 60
          },
          {
            "seq": 35,
            "ts": "2026-09-07T08:02:55Z",
            "lat": 54.8915568,
            "lon": 23.9027109,
            "hAcc": 8,
            "speed": 1.4,
            "course": 45,
            "alt": 60